




























































GROWROOT: CHANGED: partition=3 start=2162688 old: size=16104473 end=18267160 new: size=1951362447 end=1953525134
[  OK  ] Finished plymouth-read-wri…lymouth To Write Out Runtime Data.
[  OK  ] Finished systemd-machine-i…it a transient machine-id on disk.
[  OK  ] Finished systemd-tmpfiles-…eate System Files and Directories.
[  OK  ] Started haveged.servicemon based on the HAVEGE algorithm.
         Starting systemd-timesyncd… - Network Time Synchronization...
         Starting systemd-update-ut…rd System Boot/Shutdown in UTMP...
[  OK  ] Finished systemd-update-ut…cord System Boot/Shutdown in UTMP.
[  OK  ] Started systemd-udevd.serv…nager for Device Events and Files.
         Starting systemd-networkd.…ice - Network Configuration...
[  OK  ] Found device dev-ttyAMA0.device - /dev/ttyAMA0.
[  OK  ] Finished systemd-udev-trig…e - Coldplug All udev Devices.
         Starting plymouth-start.se…[0m - Show Plymouth Boot Screen...
[  OK  ] Found device dev-disk-by\x… Samsung SSD 990 EVO Plus 1TB efi.
         Starting systemd-fsck@dev-… on /dev/disk/by-uuid/9C26-8CEE...
[  OK  ] Started plymouth-start.ser…e - Show Plymouth Boot Screen.
[  OK  ] Started systemd-ask-passwo…uests to Plymouth Directory Watch.
[  OK  ] Reached target cryptsetup.…get - Local Encrypted Volumes.
[  OK  ] Started systemd-fsckd.serv…tem Check Daemon to report status.
[  OK  ] Finished systemd-fsck@dev-…ck on /dev/disk/by-uuid/9C26-8CEE.
[    2.980894] [pid:481,cpu7,(udev-worker)]sky1-pinctrl CIXHA016:00: does not have pin group pinctrl_substrate_i2s5_dbg
[    2.992591] [pid:481,cpu7,(udev-worker)]sky1-pinctrl CIXHA016:00: Pin group cannot be found
[    3.025949] [pid:481,cpu8,(udev-worker)]sky1-pinctrl CIXHA016:00: does not have pin group pinctrl_substrate_i2s6_dbg
[    3.037201] [pid:481,cpu1,(udev-worker)]sky1-pinctrl CIXHA016:00: Pin group cannot be found
[    3.054934] [pid:481,cpu0,(udev-worker)]sky1-pinctrl CIXHA016:00: does not have pin group pinctrl_substrate_i2s7_dbg
[    3.065743] [pid:481,cpu2,(udev-worker)]sky1-pinctrl CIXHA016:00: Pin group cannot be found
[    3.075868] [pid:481,cpu1,(udev-worker)]sky1-pinctrl CIXHA016:00: does not have pin group pinctrl_substrate_i2s8_dbg
[    3.086426] [pid:481,cpu1,(udev-worker)]sky1-pinctrl CIXHA016:00: Pin group cannot be found
[  OK  ] Created slice system[    3.096899] [pid:481,cpu7,(udev-worker)]sky1-pinctrl CIXHA016:00: does not have pin group pinctrl_substrate_i2s9_dbg
-syste…- Slice /system/systemd[    3.109954] [pid:481,cpu7,(udev-worker)]sky1-pinctrl CIXHA016:00: Pin group cannot be found
-backlight.
         Starting systemd-backlight…htness of backlight:CIXH5041:00...
[  OK  ] Finished systemd-backlight…ightness of backlight:CIXH5041:00.
[  OK  ] Listening on systemd-rfkil…l Switch Status /dev/rfkill Watch.
         Starting modprobe@dm_mod.s…[0m - Load Kernel Module dm_mod...
         Starting modprobe@efi_psto…- Load Kernel Module efi_pstore...
         Starting modprobe@loop.ser…e - Load Kernel Module loop...
[  OK  ] Finished modprobe@loop.service - Load Kernel Module loop.
[  OK  ] Finished modprobe@dm_mod.s…e - Load Kernel Module dm_mod.
[  OK  ] Finished modprobe@efi_psto…m - Load Kernel Module efi_pstore.
[    3.431911] [pid:463,cpu0,(udev-worker)]armchina CIXH4000:00: sky1_npu_probe: armchina_aipu_probe done
         Mounting boot-efi.mount - /boot/efi...
         Mounting proc-sys-fs-binfm…utable File Formats File System...
[  OK  ] Mounted proc-sys-fs-binfmt…ecutable File Formats File System.
[  OK  ] Finished systemd-binfmt.se… Set Up Additional Binary Formats.
[  OK  ] Mounted boot-efi.mount - /boot/efi.
[  OK  ] Finished systemd-boot-upda…0m - Automatic Boot Loader Update.
[  OK  ] Started systemd-timesyncd.…0m - Network Time Synchronization.
[  OK  ] Reached target sysinit.target - System Initialization.
[  OK  ] Started cups.path - CUPS Scheduler.
[  OK  ] Started local-apt-repository.path.
[  OK  ] Started systemd-tmpfiles-c… Cleanup of Temporary Directories.
[  OK  ] Reached target paths.target - Path Units.
[  OK  ] Reached target time-set.target - System Time Set.
[  OK  ] Started apt-daily.timer - Daily apt download activities.
[  OK  ] Started apt-daily-upgrade.… apt upgrade and clean activities.
[  OK  ] Started dpkg-db-backup.tim… Daily dpkg database backup timer.
[  OK  ] Started e2scrub_all.timeretadata Check for All Filesystems.
[  OK  ] Started fstrim.timer - Discard unused blocks once a week.
[  OK  ] Started fwupd-refresh.time… Refresh fwupd metadata regularly.
[  OK  ] Started man-db.timer - Daily man-db regeneration.
[  OK  ] Reached target timers.target - Timer Units.
[  OK  ] Listening on avahi-daemon.…NS/DNS-SD Stack Activation Socket.
[  OK  ] Listening on cups.socket - CUPS Scheduler.
[  OK  ] Listening on dbus.socket- D-Bus System Message Bus Socket.
[  OK  ] Listening on ssh.socketpenBSD Secure Shell server socket.
[  OK  ] Reached target sockets.target - Socket Units.
[  OK  ] Reached target basic.target - Basic System.
         Starting accounts-daemon.service - Accounts Service...
         Starting alsa-restore.serv…- Save/Restore Sound Card State...
         Starting avahi-daemon.serv…e - Avahi mDNS/DNS-SD Stack...
         Starting dbus.service - D-Bus System Message Bus...
         Starting e2scrub_reap.serv…e ext4 Metadata Check Snapshots...
[  OK  ] Started irqbalance.service - irqbalance daemon.
         Starting lm-sensors.servic…ize hardware monitoring sensors...
         Starting load-common-modul…rvice - Load common modules...
         Starting load-gpu-modules.service - Load gpu modules...
         Starting load-isp-modules.…e - Load isp kernel modules...
[  OK  ] Started rsetup.service - rsetup configuration service.
         Starting rtkit-daemon.serv…meKit Scheduling Policy Service...
         Starting systemd-logind.se…ice - User Login Management...
         Starting udisks2.service - Disk Manager...
         Starting upower.service - Daemon for power management...
         Starting zramswap.service - Linux zramswap setup...
[  OK  ] Started systemd-networkd.service - Network Configuration.
[  OK  ] Finished alsa-restore.serv…m - Save/Restore Sound Card State.
[  OK  ] Finished e2scrub_reap.serv…ine ext4 Metadata Check Snapshots.
[  OK  ] Started dbus.service - D-Bus System Message Bus.
[FAILED] Failed to start load-isp-m…ice - Load isp kernel modules.
See 'systemctl status load-isp-modules.service' for details.
[  OK  ] Reached target sound.target - Sound Card.
         Starting NetworkManager.service - Network Manager...
         Starting systemd-networkd-…it for Network to be Configured...
         Starting wpa_supplicant.service - WPA supplicant...
[  OK  ] Finished load-gpu-modules.service - Load gpu modules.
[  OK  ] Started rtkit-daemon.servi…timeKit Scheduling Policy Service.
[  OK  ] Started avahi-daemon.service - Avahi mDNS/DNS-SD Stack.
         Starting systemd-fsck@dev-… on /dev/disk/by-uuid/9C26-3AB6...
[  OK  ] Started wpa_supplicant.service - WPA supplicant.
[  OK  ] Finished systemd-fsck@dev-…ck on /dev/disk/by-uuid/9C26-3AB6.
         Mounting config.mount - /config...
         Starting polkit.service - Authorization Manager...
         Starting modprobe@drm.service - Load Kernel Module drm...
[  OK  ] Mounted config.mount - /config.
[  OK  ] Finished modprobe@drm.service - Load Kernel Module drm.
[  OK  ] Started systemd-logind.service - User Login Management.
[  OK  ] Finished zramswap.service - Linux zramswap setup.
[  OK  ] Started polkit.service - Authorization Manager.
[  OK  ] Started accounts-daemon.service - Accounts Service.
[  OK  ] Started NetworkManager.service - Network Manager.
[  OK  ] Reached target network.target - Network.
[  OK  ] Reached target radxa-otgut…rget - Radxa USB OTG services.
         Starting NetworkManager-wa…m - Network Manager Wait Online...
         Starting cups.service - CUPS Scheduler...
[  OK  ] Started isp-daemon.service - ISP Daemon.
         Starting ssh.service - OpenBSD Secure Shell server...
         Starting systemd-user-sess…vice - Permit User Sessions...
         Starting systemd-hostnamed.service - Hostname Service...
[  OK  ] Finished systemd-user-sess…ervice - Permit User Sessions.
         Starting gdm.service - GNOME Display Manager...
         Starting plymouth-quit-wai… until boot process finishes up...
[  OK  ] Started upower.service - Daemon for power management.
[  OK  ] Started cups.service - CUPS Scheduler.
[  OK  ] Started udisks2.service - Disk Manager.
[  OK  ] Finished lm-sensors.servic…alize hardware monitoring sensors.
[  OK  ] Started ssh.service - OpenBSD Secure Shell server.
[  OK  ] Started systemd-hostnamed.service - Hostname Service.
         Starting NetworkManager-di…nager Script Dispatcher Service...
[  OK  ] Started NetworkManager-dis…Manager Script Dispatcher Service.
[  OK  ] Finished load-common-modul…service - Load common modules.

Debian GNU/Linux 12 RadxaOrionO6 ttyAMA0

RadxaOrionO6 login: 
RadxaOrionO6 login: radxa
Password: 
Linux RadxaOrionO6 6.6.89-3-sky1 #3 SMP PREEMPT Mon Dec 15 11:06:55 UTC 2025 aarch64

The programs included with the Debian GNU/Linux system are free software;
the exact distribution terms for each program are described in the
individual files in /usr/share/doc/*/copyright.

Debian GNU/Linux comes with ABSOLUTELY NO WARRANTY, to the extent
permitted by applicable law.
radxa@RadxaOrionO6:~$ 
radxa@RadxaOrionO6:~$ 
radxa@RadxaOrionO6:~$ 
radxa@RadxaOrionO6:~$ 
radxa@RadxaOrionO6:~$ ls
radxa@RadxaOrionO6:~$ pwd
/home/radxa
radxa@RadxaOrionO6:~$ ls
radxa@RadxaOrionO6:~$ ip link
1: lo: <LOOPBACK,UP,LOWER_UP> mtu 65536 qdisc noqueue state UNKNOWN mode DEFAULT group default qlen 1000
    link/loopback 00:00:00:00:00:00 brd 00:00:00:00:00:00
2: eth0: <NO-CARRIER,BROADCAST,MULTICAST,UP> mtu 1500 qdisc mq state DOWN mode DEFAULT group default qlen 1000
    link/ether 00:48:54:20:99:e8 brd ff:ff:ff:ff:ff:ff
    altname enp49s0
3: eth1: <NO-CARRIER,BROADCAST,MULTICAST,UP> mtu 1500 qdisc mq state DOWN mode DEFAULT group default qlen 1000
    link/ether 00:48:54:20:99:e7 brd ff:ff:ff:ff:ff:ff
    altname enp1s0
radxa@RadxaOrionO6:~$ ip addr
1: lo: <LOOPBACK,UP,LOWER_UP> mtu 65536 qdisc noqueue state UNKNOWN group default qlen 1000
    link/loopback 00:00:00:00:00:00 brd 00:00:00:00:00:00
    inet 127.0.0.1/8 scope host lo
       valid_lft forever preferred_lft forever
    inet6 ::1/128 scope host noprefixroute 
       valid_lft forever preferred_lft forever
2: eth0: <NO-CARRIER,BROADCAST,MULTICAST,UP> mtu 1500 qdisc mq state DOWN group default qlen 1000
    link/ether 00:48:54:20:99:e8 brd ff:ff:ff:ff:ff:ff
    altname enp49s0
3: eth1: <NO-CARRIER,BROADCAST,MULTICAST,UP> mtu 1500 qdisc mq state DOWN group default qlen 1000
    link/ether 00:48:54:20:99:e7 brd ff:ff:ff:ff:ff:ff
    altname enp1s0
radxa@RadxaOrionO6:~$ 
radxa@RadxaOrionO6:~$ 
radxa@RadxaOrionO6:~$ 
radxa@RadxaOrionO6:~$ lspci
00:00.0 PCI bridge: CIX Technology Group Co., Ltd. CIX P1 CD8180 PCI Express Root Port
01:00.0 Ethernet controller: Realtek Semiconductor Co., Ltd. RTL8126 5GbE Controller (rev 01)
30:00.0 PCI bridge: CIX Technology Group Co., Ltd. CIX P1 CD8180 PCI Express Root Port
31:00.0 Ethernet controller: Realtek Semiconductor Co., Ltd. RTL8126 5GbE Controller (rev 01)
90:00.0 PCI bridge: CIX Technology Group Co., Ltd. CIX P1 CD8180 PCI Express Root Port
91:00.0 Non-Volatile memory controller: Samsung Electronics Co Ltd NVMe SSD Controller PM9C1a (DRAM-less)
c0:00.0 PCI bridge: CIX Technology Group Co., Ltd. CIX P1 CD8180 PCI Express Root Port
c1:00.0 Ethernet controller: Mellanox Technologies MT28800 Family [ConnectX-5 Ex]
c1:00.1 Ethernet controller: Mellanox Technologies MT28800 Family [ConnectX-5 Ex]
radxa@RadxaOrionO6:~$ 
radxa@RadxaOrionO6:~$ lspci -vvv
00:00.0 PCI bridge: CIX Technology Group Co., Ltd. CIX P1 CD8180 PCI Express Root Port (prog-if 00 [Normal decode])
        Control: I/O+ Mem+ BusMaster+ SpecCycle- MemWINV- VGASnoop- ParErr- Stepping- SERR- FastB2B- DisINTx+
        Status: Cap+ 66MHz- UDF- FastB2B- ParErr- DEVSEL=fast >TAbort- <TAbort- <MAbort- >SERR- <PERR- INTx-
        Latency: 0
        Interrupt: pin A routed to IRQ 143
        IOMMU group: 6
        Bus: primary=00, secondary=01, subordinate=2f, sec-latency=0
        I/O behind bridge: 300000-300fff [size=4K] [16-bit]
        Memory behind bridge: 30300000-303fffff [size=1M] [32-bit]
        Prefetchable memory behind bridge: 00000000fff00000-00000000000fffff [disabled] [64-bit]
        Secondary status: 66MHz- FastB2B- ParErr- DEVSEL=fast >TAbort- <TAbort- <MAbort- <SERR- <PERR-
        Expansion ROM at 30200000 [virtual] [disabled] [size=1M]
        BridgeCtl: Parity- SERR+ NoISA- VGA- VGA16- MAbort- >Reset- FastB2B-
                PriDiscTmr- SecDiscTmr- DiscTmrStat- DiscTmrSERREn-
        Capabilities: <access denied>
        Kernel driver in use: pcieport

01:00.0 Ethernet controller: Realtek Semiconductor Co., Ltd. RTL8126 5GbE Controller (rev 01)
        Subsystem: Realtek Semiconductor Co., Ltd. RTL8126 5GbE Controller
        Control: I/O+ Mem+ BusMaster+ SpecCycle- MemWINV- VGASnoop- ParErr- Stepping- SERR- FastB2B- DisINTx+
        Status: Cap+ 66MHz- UDF- FastB2B- ParErr- DEVSEL=fast >TAbort- <TAbort- <MAbort- >SERR- <PERR- INTx-
        Latency: 0, Cache Line Size: 64 bytes
        Interrupt: pin A routed to IRQ 142
        IOMMU group: 6
        Region 0: I/O ports at 300000 [size=256]
        Region 2: Memory at 30300000 (64-bit, non-prefetchable) [size=64K]
        Region 4: Memory at 30310000 (64-bit, non-prefetchable) [size=16K]
        Capabilities: <access denied>
        Kernel driver in use: r8126
        Kernel modules: r8126

30:00.0 PCI bridge: CIX Technology Group Co., Ltd. CIX P1 CD8180 PCI Express Root Port (prog-if 00 [Normal decode])
        Control: I/O+ Mem+ BusMaster+ SpecCycle- MemWINV- VGASnoop- ParErr- Stepping- SERR- FastB2B- DisINTx+
        Status: Cap+ 66MHz- UDF- FastB2B- ParErr- DEVSEL=fast >TAbort- <TAbort- <MAbort- >SERR- <PERR- INTx-
        Latency: 0
        Interrupt: pin A routed to IRQ 141
        IOMMU group: 2
        Bus: primary=30, secondary=31, subordinate=5f, sec-latency=0
        I/O behind bridge: 200000-200fff [size=4K] [16-bit]
        Memory behind bridge: 38300000-383fffff [size=1M] [32-bit]
        Prefetchable memory behind bridge: 00000000fff00000-00000000000fffff [disabled] [64-bit]
        Secondary status: 66MHz- FastB2B- ParErr- DEVSEL=fast >TAbort- <TAbort- <MAbort- <SERR- <PERR-
        Expansion ROM at 38200000 [virtual] [disabled] [size=1M]
        BridgeCtl: Parity- SERR+ NoISA- VGA- VGA16- MAbort- >Reset- FastB2B-
                PriDiscTmr- SecDiscTmr- DiscTmrStat- DiscTmrSERREn-
        Capabilities: <access denied>
        Kernel driver in use: pcieport

31:00.0 Ethernet controller: Realtek Semiconductor Co., Ltd. RTL8126 5GbE Controller (rev 01)
        Subsystem: Realtek Semiconductor Co., Ltd. RTL8126 5GbE Controller
        Control: I/O+ Mem+ BusMaster+ SpecCycle- MemWINV- VGASnoop- ParErr- Stepping- SERR- FastB2B- DisINTx+
        Status: Cap+ 66MHz- UDF- FastB2B- ParErr- DEVSEL=fast >TAbort- <TAbort- <MAbort- >SERR- <PERR- INTx-
        Latency: 0, Cache Line Size: 64 bytes
        Interrupt: pin A routed to IRQ 139
        IOMMU group: 2
        Region 0: I/O ports at 200000 [size=256]
        Region 2: Memory at 38300000 (64-bit, non-prefetchable) [size=64K]
        Region 4: Memory at 38310000 (64-bit, non-prefetchable) [size=16K]
        Capabilities: <access denied>
        Kernel driver in use: r8126
        Kernel modules: r8126

90:00.0 PCI bridge: CIX Technology Group Co., Ltd. CIX P1 CD8180 PCI Express Root Port (prog-if 00 [Normal decode])
        Control: I/O- Mem+ BusMaster+ SpecCycle- MemWINV- VGASnoop- ParErr- Stepping- SERR- FastB2B- DisINTx+
        Status: Cap+ 66MHz- UDF- FastB2B- ParErr- DEVSEL=fast >TAbort- <TAbort- <MAbort- >SERR- <PERR- INTx-
        Latency: 0
        Interrupt: pin A routed to IRQ 137
        IOMMU group: 0
        Bus: primary=90, secondary=91, subordinate=bf, sec-latency=0
        I/O behind bridge: 0000f000-00000fff [disabled] [32-bit]
        Memory behind bridge: 50300000-503fffff [size=1M] [32-bit]
        Prefetchable memory behind bridge: 00000000fff00000-00000000000fffff [disabled] [64-bit]
        Secondary status: 66MHz- FastB2B- ParErr- DEVSEL=fast >TAbort- <TAbort- <MAbort- <SERR- <PERR-
        Expansion ROM at 50200000 [virtual] [disabled] [size=1M]
        BridgeCtl: Parity- SERR+ NoISA- VGA- VGA16- MAbort- >Reset- FastB2B-
                PriDiscTmr- SecDiscTmr- DiscTmrStat- DiscTmrSERREn-
        Capabilities: <access denied>
        Kernel driver in use: pcieport

91:00.0 Non-Volatile memory controller: Samsung Electronics Co Ltd NVMe SSD Controller PM9C1a (DRAM-less) (prog-if 02 [NVM Express])
        Subsystem: Samsung Electronics Co Ltd NVMe SSD Controller PM9C1a (DRAM-less)
        Control: I/O- Mem+ BusMaster+ SpecCycle- MemWINV- VGASnoop- ParErr- Stepping- SERR- FastB2B- DisINTx+
        Status: Cap+ 66MHz- UDF- FastB2B- ParErr- DEVSEL=fast >TAbort- <TAbort- <MAbort- >SERR- <PERR- INTx-
        Latency: 0
        Interrupt: pin A routed to IRQ 136
        IOMMU group: 0
        Region 0: Memory at 50300000 (64-bit, non-prefetchable) [size=16K]
        Capabilities: <access denied>
        Kernel driver in use: nvme

c0:00.0 PCI bridge: CIX Technology Group Co., Ltd. CIX P1 CD8180 PCI Express Root Port (prog-if 00 [Normal decode])
        Control: I/O- Mem+ BusMaster+ SpecCycle- MemWINV- VGASnoop- ParErr- Stepping- SERR- FastB2B- DisINTx+
        Status: Cap+ 66MHz- UDF- FastB2B- ParErr- DEVSEL=fast >TAbort- <TAbort- <MAbort+ >SERR- <PERR- INTx-
        Latency: 0
        Interrupt: pin A routed to IRQ 138
        IOMMU group: 1
        Bus: primary=c0, secondary=c1, subordinate=ff, sec-latency=0
        I/O behind bridge: 0000f000-00000fff [disabled] [32-bit]
        Memory behind bridge: 60300000-604fffff [size=2M] [32-bit]
        Prefetchable memory behind bridge: 1800000000-1813ffffff [size=320M] [32-bit]
        Secondary status: 66MHz- FastB2B- ParErr- DEVSEL=fast >TAbort- <TAbort- <MAbort- <SERR- <PERR-
        Expansion ROM at 60200000 [virtual] [disabled] [size=1M]
        BridgeCtl: Parity- SERR+ NoISA- VGA- VGA16- MAbort- >Reset- FastB2B-
                PriDiscTmr- SecDiscTmr- DiscTmrStat- DiscTmrSERREn-
        Capabilities: <access denied>
        Kernel driver in use: pcieport

c1:00.0 Ethernet controller: Mellanox Technologies MT28800 Family [ConnectX-5 Ex]
        Subsystem: Mellanox Technologies ConnectX-5 Ex EN network interface card, 100GbE dual-port QSFP28, PCIe4.0 x16, tall bracket; MCX516A-CDAT
        Control: I/O- Mem- BusMaster- SpecCycle- MemWINV- VGASnoop- ParErr- Stepping- SERR- FastB2B- DisINTx-
        Status: Cap+ 66MHz- UDF- FastB2B- ParErr- DEVSEL=fast >TAbort- <TAbort- <MAbort- >SERR- <PERR- INTx-
        Interrupt: pin A routed to IRQ 0
        Region 0: Memory at 1800000000 (64-bit, prefetchable) [disabled] [size=32M]
        Expansion ROM at 60300000 [virtual] [disabled] [size=1M]
        Capabilities: <access denied>

c1:00.1 Ethernet controller: Mellanox Technologies MT28800 Family [ConnectX-5 Ex]
        Subsystem: Mellanox Technologies ConnectX-5 Ex EN network interface card, 100GbE dual-port QSFP28, PCIe4.0 x16, tall bracket; MCX516A-CDAT
        Control: I/O- Mem- BusMaster- SpecCycle- MemWINV- VGASnoop- ParErr- Stepping- SERR- FastB2B- DisINTx-
        Status: Cap+ 66MHz- UDF- FastB2B- ParErr- DEVSEL=fast >TAbort- <TAbort- <MAbort- >SERR- <PERR- INTx-
        Interrupt: pin B routed to IRQ 0
        Region 0: Memory at 1802000000 (64-bit, prefetchable) [disabled] [size=32M]
        Expansion ROM at 60400000 [virtual] [disabled] [size=1M]
        Capabilities: <access denied>

radxa@RadxaOrionO6:~$ 
radxa@RadxaOrionO6:~$ 
radxa@RadxaOrionO6:~$ lspci -t
-+-[0000:00]---00.0-[01-2f]----00.0
 +-[0000:30]---00.0-[31-5f]----00.0
 +-[0000:90]---00.0-[91-bf]----00.0
 \-[0000:c0]---00.0-[c1-ff]--+-00.0
                             \-00.1
radxa@RadxaOrionO6:~$ lspci -tvv
-+-[0000:00]---00.0-[01-2f]----00.0  Realtek Semiconductor Co., Ltd. RTL8126 5GbE Controller
 +-[0000:30]---00.0-[31-5f]----00.0  Realtek Semiconductor Co., Ltd. RTL8126 5GbE Controller
 +-[0000:90]---00.0-[91-bf]----00.0  Samsung Electronics Co Ltd NVMe SSD Controller PM9C1a (DRAM-less)
 \-[0000:c0]---00.0-[c1-ff]--+-00.0  Mellanox Technologies MT28800 Family [ConnectX-5 Ex]
                             \-00.1  Mellanox Technologies MT28800 Family [ConnectX-5 Ex]
radxa@RadxaOrionO6:~$ lspci -tvvv
-+-[0000:00]---00.0-[01-2f]----00.0  Realtek Semiconductor Co., Ltd. RTL8126 5GbE Controller
 +-[0000:30]---00.0-[31-5f]----00.0  Realtek Semiconductor Co., Ltd. RTL8126 5GbE Controller
 +-[0000:90]---00.0-[91-bf]----00.0  Samsung Electronics Co Ltd NVMe SSD Controller PM9C1a (DRAM-less)
 \-[0000:c0]---00.0-[c1-ff]--+-00.0  Mellanox Technologies MT28800 Family [ConnectX-5 Ex]
                             \-00.1  Mellanox Technologies MT28800 Family [ConnectX-5 Ex]
radxa@RadxaOrionO6:~$ sudo lspci -vvv
[sudo] password for radxa: 
00:00.0 PCI bridge: CIX Technology Group Co., Ltd. CIX P1 CD8180 PCI Express Root Port (prog-if 00 [Normal decode])
        Control: I/O+ Mem+ BusMaster+ SpecCycle- MemWINV- VGASnoop- ParErr- Stepping- SERR- FastB2B- DisINTx+
        Status: Cap+ 66MHz- UDF- FastB2B- ParErr- DEVSEL=fast >TAbort- <TAbort- <MAbort- >SERR- <PERR- INTx-
        Latency: 0
        Interrupt: pin A routed to IRQ 143
        IOMMU group: 6
        Bus: primary=00, secondary=01, subordinate=2f, sec-latency=0
        I/O behind bridge: 300000-300fff [size=4K] [16-bit]
        Memory behind bridge: 30300000-303fffff [size=1M] [32-bit]
        Prefetchable memory behind bridge: 00000000fff00000-00000000000fffff [disabled] [64-bit]
        Secondary status: 66MHz- FastB2B- ParErr- DEVSEL=fast >TAbort- <TAbort- <MAbort- <SERR- <PERR-
        Expansion ROM at 30200000 [virtual] [disabled] [size=1M]
        BridgeCtl: Parity- SERR+ NoISA- VGA- VGA16- MAbort- >Reset- FastB2B-
                PriDiscTmr- SecDiscTmr- DiscTmrStat- DiscTmrSERREn-
        Capabilities: [80] Power Management version 3
                Flags: PMEClk- DSI- D1+ D2- AuxCurrent=0mA PME(D0+,D1+,D2-,D3hot+,D3cold-)
                Status: D0 NoSoftRst+ PME-Enable- DSel=0 DScale=0 PME-
        Capabilities: [90] MSI: Enable+ Count=1/32 Maskable+ 64bit+
                Address: 00000000fffff040  Data: 0000
                Masking: fffffffe  Pending: 00000000
        Capabilities: [b0] MSI-X: Enable- Count=2 Masked-
                Vector table: BAR=0 offset=00000040
                PBA: BAR=0 offset=00000040
        Capabilities: [c0] Express (v2) Root Port (Slot-), MSI 00
                DevCap: MaxPayload 512 bytes, PhantFunc 0
                        ExtTag- RBE+
                DevCtl: CorrErr+ NonFatalErr+ FatalErr+ UnsupReq+
                        RlxdOrd+ ExtTag- PhantFunc- AuxPwr- NoSnoop+
                        MaxPayload 512 bytes, MaxReadReq 1024 bytes
                DevSta: CorrErr- NonFatalErr- FatalErr- UnsupReq- AuxPwr- TransPend-
                LnkCap: Port #0, Speed 16GT/s, Width x1, ASPM L0s L1, Exit Latency L0s <256ns, L1 <8us
                        ClockPM- Surprise- LLActRep+ BwNot- ASPMOptComp+
                LnkCtl: ASPM Disabled; RCB 64 bytes, Disabled- CommClk+
                        ExtSynch- ClockPM- AutWidDis- BWInt- AutBWInt-
                LnkSta: Speed 8GT/s, Width x1
                        TrErr- Train- SlotClk+ DLActive+ BWMgmt- ABWMgmt-
                RootCap: CRSVisible-
                RootCtl: ErrCorrectable- ErrNon-Fatal- ErrFatal- PMEIntEna+ CRSVisible-
                RootSta: PME ReqID 0000, PMEStatus- PMEPending-
                DevCap2: Completion Timeout: Range ABCD, TimeoutDis+ NROPrPrP- LTR+
                         10BitTagComp+ 10BitTagReq- OBFF Via message, ExtFmt+ EETLPPrefix+, MaxEETLPPrefixes 1
                         EmergencyPowerReduction Not Supported, EmergencyPowerReductionInit-
                         FRS- LN System CLS Not Supported, TPHComp- ExtTPHComp- ARIFwd-
                         AtomicOpsCap: Routing+ 32bit+ 64bit+ 128bitCAS+
                DevCtl2: Completion Timeout: 50us to 50ms, TimeoutDis- LTR+ 10BitTagReq- OBFF Disabled, ARIFwd-
                         AtomicOpsCtl: ReqEn- EgressBlck-
                LnkCap2: Supported Link Speeds: 2.5-16GT/s, Crosslink- Retimer+ 2Retimers+ DRS-
                LnkCtl2: Target Link Speed: 16GT/s, EnterCompliance- SpeedDis-
                         Transmit Margin: Normal Operating Range, EnterModifiedCompliance- ComplianceSOS-
                         Compliance Preset/De-emphasis: -6dB de-emphasis, 0dB preshoot
                LnkSta2: Current De-emphasis Level: -6dB, EqualizationComplete+ EqualizationPhase1+
                         EqualizationPhase2+ EqualizationPhase3+ LinkEqualizationRequest-
                         Retimer- 2Retimers- CrosslinkRes: unsupported
        Capabilities: [100 v2] Advanced Error Reporting
                UESta:  DLP- SDES- TLP- FCP- CmpltTO- CmpltAbrt- UnxCmplt- RxOF- MalfTLP- ECRC- UnsupReq- ACSViol-
                UEMsk:  DLP- SDES- TLP- FCP- CmpltTO- CmpltAbrt- UnxCmplt- RxOF- MalfTLP- ECRC- UnsupReq- ACSViol-
                UESvrt: DLP+ SDES- TLP- FCP+ CmpltTO- CmpltAbrt- UnxCmplt- RxOF+ MalfTLP+ ECRC- UnsupReq- ACSViol-
                CESta:  RxErr- BadTLP- BadDLLP- Rollover- Timeout- AdvNonFatalErr-
                CEMsk:  RxErr- BadTLP- BadDLLP- Rollover- Timeout- AdvNonFatalErr+
                AERCap: First Error Pointer: 01, ECRCGenCap+ ECRCGenEn- ECRCChkCap+ ECRCChkEn-
                        MultHdrRecCap- MultHdrRecEn- TLPPfxPres- HdrLogCap-
                HeaderLog: 00000000 00000000 00000000 00000000
                RootCmd: CERptEn+ NFERptEn+ FERptEn+
                RootSta: CERcvd- MultCERcvd- UERcvd- MultUERcvd-
                         FirstFatal- NonFatalMsg- FatalMsg- IntMsg 0
                ErrorSrc: ERR_COR: 0000 ERR_FATAL/NONFATAL: 0000
        Capabilities: [150 v1] Device Serial Number 00-00-00-00-00-00-00-00
        Capabilities: [300 v1] Secondary PCI Express
                LnkCtl3: LnkEquIntrruptEn- PerformEqu-
                LaneErrStat: 0
        Capabilities: [4c0 v1] Virtual Channel
                Caps:   LPEVC=0 RefClk=100ns PATEntryBits=1
                Arb:    Fixed- WRR32- WRR64- WRR128-
                Ctrl:   ArbSelect=Fixed
                Status: InProgress-
                VC0:    Caps:   PATOffset=00 MaxTimeSlots=1 RejSnoopTrans-
                        Arb:    Fixed- WRR32- WRR64- WRR128- TWRR128- WRR256-
                        Ctrl:   Enable+ ID=0 ArbSelect=Fixed TC/VC=ff
                        Status: NegoPending- InProgress-
        Capabilities: [900 v1] L1 PM Substates
                L1SubCap: PCI-PM_L1.2+ PCI-PM_L1.1+ ASPM_L1.2+ ASPM_L1.1+ L1_PM_Substates+
                          PortCommonModeRestoreTime=0us PortTPowerOnTime=10us
                L1SubCtl1: PCI-PM_L1.2- PCI-PM_L1.1- ASPM_L1.2- ASPM_L1.1-
                           T_CommonMode=150us LTR1.2_Threshold=306176ns
                L1SubCtl2: T_PwrOn=150us
        Capabilities: [910 v1] Data Link Feature <?>
        Capabilities: [920 v1] Lane Margining at the Receiver <?>
        Capabilities: [9c0 v1] Physical Layer 16.0 GT/s <?>
        Capabilities: [a20 v1] Precision Time Measurement
                PTMCap: Requester:- Responder:+ Root:+
                PTMClockGranularity: 2ns
                PTMControl: Enabled:- RootSelected:-
                PTMEffectiveGranularity: Unknown
        Capabilities: [a90 v1] Extended Capability ID 0x2f
        Kernel driver in use: pcieport

01:00.0 Ethernet controller: Realtek Semiconductor Co., Ltd. RTL8126 5GbE Controller (rev 01)
        Subsystem: Realtek Semiconductor Co., Ltd. RTL8126 5GbE Controller
        Control: I/O+ Mem+ BusMaster+ SpecCycle- MemWINV- VGASnoop- ParErr- Stepping- SERR- FastB2B- DisINTx+
        Status: Cap+ 66MHz- UDF- FastB2B- ParErr- DEVSEL=fast >TAbort- <TAbort- <MAbort- >SERR- <PERR- INTx-
        Latency: 0, Cache Line Size: 64 bytes
        Interrupt: pin A routed to IRQ 142
        IOMMU group: 6
        Region 0: I/O ports at 300000 [size=256]
        Region 2: Memory at 30300000 (64-bit, non-prefetchable) [size=64K]
        Region 4: Memory at 30310000 (64-bit, non-prefetchable) [size=16K]
        Capabilities: [40] Power Management version 3
                Flags: PMEClk- DSI- D1+ D2+ AuxCurrent=375mA PME(D0+,D1+,D2+,D3hot+,D3cold+)
                Status: D0 NoSoftRst+ PME-Enable- DSel=0 DScale=0 PME-
        Capabilities: [50] MSI: Enable- Count=1/1 Maskable+ 64bit+
                Address: 0000000000000000  Data: 0000
                Masking: 00000000  Pending: 00000000
        Capabilities: [70] Express (v2) Endpoint, MSI 01
                DevCap: MaxPayload 512 bytes, PhantFunc 0, Latency L0s <512ns, L1 <64us
                        ExtTag- AttnBtn- AttnInd- PwrInd- RBE+ FLReset- SlotPowerLimit 0W
                DevCtl: CorrErr+ NonFatalErr+ FatalErr+ UnsupReq+
                        RlxdOrd+ ExtTag- PhantFunc- AuxPwr- NoSnoop-
                        MaxPayload 512 bytes, MaxReadReq 512 bytes
                DevSta: CorrErr- NonFatalErr- FatalErr- UnsupReq- AuxPwr+ TransPend-
                LnkCap: Port #0, Speed 8GT/s, Width x1, ASPM L0s L1, Exit Latency L0s unlimited, L1 <64us
                        ClockPM+ Surprise- LLActRep- BwNot- ASPMOptComp+
                LnkCtl: ASPM Disabled; RCB 64 bytes, Disabled- CommClk+
                        ExtSynch- ClockPM- AutWidDis- BWInt- AutBWInt-
                LnkSta: Speed 8GT/s, Width x1
                        TrErr- Train- SlotClk+ DLActive- BWMgmt- ABWMgmt-
                DevCap2: Completion Timeout: Range ABCD, TimeoutDis+ NROPrPrP- LTR+
                         10BitTagComp- 10BitTagReq- OBFF Via message/WAKE#, ExtFmt- EETLPPrefix-
                         EmergencyPowerReduction Not Supported, EmergencyPowerReductionInit-
                         FRS- TPHComp+ ExtTPHComp-
                         AtomicOpsCap: 32bit- 64bit- 128bitCAS-
                DevCtl2: Completion Timeout: 50us to 50ms, TimeoutDis- LTR+ 10BitTagReq- OBFF Disabled,
                         AtomicOpsCtl: ReqEn-
                LnkCap2: Supported Link Speeds: 2.5-8GT/s, Crosslink- Retimer- 2Retimers- DRS-
                LnkCtl2: Target Link Speed: 8GT/s, EnterCompliance- SpeedDis-
                         Transmit Margin: Normal Operating Range, EnterModifiedCompliance- ComplianceSOS-
                         Compliance Preset/De-emphasis: -6dB de-emphasis, 0dB preshoot
                LnkSta2: Current De-emphasis Level: -6dB, EqualizationComplete+ EqualizationPhase1+
                         EqualizationPhase2+ EqualizationPhase3+ LinkEqualizationRequest-
                         Retimer- 2Retimers- CrosslinkRes: unsupported
        Capabilities: [b0] MSI-X: Enable+ Count=32 Masked-
                Vector table: BAR=4 offset=00000000
                PBA: BAR=4 offset=00000800
        Capabilities: [d0] Vital Product Data
pcilib: sysfs_read_vpd: read failed: No such device
                Not readable
        Capabilities: [100 v2] Advanced Error Reporting
                UESta:  DLP- SDES- TLP- FCP- CmpltTO- CmpltAbrt- UnxCmplt- RxOF- MalfTLP- ECRC- UnsupReq- ACSViol-
                UEMsk:  DLP- SDES- TLP- FCP- CmpltTO- CmpltAbrt- UnxCmplt- RxOF- MalfTLP- ECRC- UnsupReq+ ACSViol-
                UESvrt: DLP+ SDES+ TLP- FCP+ CmpltTO- CmpltAbrt- UnxCmplt- RxOF+ MalfTLP+ ECRC- UnsupReq- ACSViol-
                CESta:  RxErr- BadTLP- BadDLLP- Rollover- Timeout- AdvNonFatalErr-
                CEMsk:  RxErr- BadTLP- BadDLLP- Rollover- Timeout- AdvNonFatalErr+
                AERCap: First Error Pointer: 00, ECRCGenCap+ ECRCGenEn- ECRCChkCap+ ECRCChkEn-
                        MultHdrRecCap- MultHdrRecEn- TLPPfxPres- HdrLogCap-
                HeaderLog: 00000000 00000000 00000000 00000000
        Capabilities: [148 v1] Virtual Channel
                Caps:   LPEVC=0 RefClk=100ns PATEntryBits=1
                Arb:    Fixed- WRR32- WRR64- WRR128-
                Ctrl:   ArbSelect=Fixed
                Status: InProgress-
                VC0:    Caps:   PATOffset=00 MaxTimeSlots=1 RejSnoopTrans-
                        Arb:    Fixed- WRR32- WRR64- WRR128- TWRR128- WRR256-
                        Ctrl:   Enable+ ID=0 ArbSelect=Fixed TC/VC=ff
                        Status: NegoPending- InProgress-
        Capabilities: [170 v1] Device Serial Number 01-00-00-00-68-4c-e0-00
        Capabilities: [180 v1] Secondary PCI Express
                LnkCtl3: LnkEquIntrruptEn- PerformEqu-
                LaneErrStat: 0
        Capabilities: [190 v1] Transaction Processing Hints
                No steering table available
        Capabilities: [21c v1] Latency Tolerance Reporting
                Max snoop latency: 0ns
                Max no snoop latency: 0ns
        Capabilities: [224 v1] L1 PM Substates
                L1SubCap: PCI-PM_L1.2+ PCI-PM_L1.1+ ASPM_L1.2+ ASPM_L1.1+ L1_PM_Substates+
                          PortCommonModeRestoreTime=150us PortTPowerOnTime=150us
                L1SubCtl1: PCI-PM_L1.2- PCI-PM_L1.1- ASPM_L1.2- ASPM_L1.1-
                           T_CommonMode=0us LTR1.2_Threshold=306176ns
                L1SubCtl2: T_PwrOn=150us
        Capabilities: [234 v1] Vendor Specific Information: ID=0002 Rev=4 Len=100 <?>
        Kernel driver in use: r8126
        Kernel modules: r8126

30:00.0 PCI bridge: CIX Technology Group Co., Ltd. CIX P1 CD8180 PCI Express Root Port (prog-if 00 [Normal decode])
        Control: I/O+ Mem+ BusMaster+ SpecCycle- MemWINV- VGASnoop- ParErr- Stepping- SERR- FastB2B- DisINTx+
        Status: Cap+ 66MHz- UDF- FastB2B- ParErr- DEVSEL=fast >TAbort- <TAbort- <MAbort- >SERR- <PERR- INTx-
        Latency: 0
        Interrupt: pin A routed to IRQ 141
        IOMMU group: 2
        Bus: primary=30, secondary=31, subordinate=5f, sec-latency=0
        I/O behind bridge: 200000-200fff [size=4K] [16-bit]
        Memory behind bridge: 38300000-383fffff [size=1M] [32-bit]
        Prefetchable memory behind bridge: 00000000fff00000-00000000000fffff [disabled] [64-bit]
        Secondary status: 66MHz- FastB2B- ParErr- DEVSEL=fast >TAbort- <TAbort- <MAbort- <SERR- <PERR-
        Expansion ROM at 38200000 [virtual] [disabled] [size=1M]
        BridgeCtl: Parity- SERR+ NoISA- VGA- VGA16- MAbort- >Reset- FastB2B-
                PriDiscTmr- SecDiscTmr- DiscTmrStat- DiscTmrSERREn-
        Capabilities: [80] Power Management version 3
                Flags: PMEClk- DSI- D1+ D2- AuxCurrent=0mA PME(D0+,D1+,D2-,D3hot+,D3cold-)
                Status: D0 NoSoftRst+ PME-Enable- DSel=0 DScale=0 PME-
        Capabilities: [90] MSI: Enable+ Count=1/32 Maskable+ 64bit+
                Address: 00000000fffff040  Data: 0000
                Masking: fffffffe  Pending: 00000000
        Capabilities: [b0] MSI-X: Enable- Count=2 Masked-
                Vector table: BAR=0 offset=00000040
                PBA: BAR=0 offset=00000040
        Capabilities: [c0] Express (v2) Root Port (Slot-), MSI 00
                DevCap: MaxPayload 512 bytes, PhantFunc 0
                        ExtTag- RBE+
                DevCtl: CorrErr+ NonFatalErr+ FatalErr+ UnsupReq+
                        RlxdOrd+ ExtTag- PhantFunc- AuxPwr- NoSnoop+
                        MaxPayload 512 bytes, MaxReadReq 1024 bytes
                DevSta: CorrErr- NonFatalErr- FatalErr- UnsupReq- AuxPwr- TransPend-
                LnkCap: Port #0, Speed 16GT/s, Width x1, ASPM L0s L1, Exit Latency L0s <256ns, L1 <8us
                        ClockPM- Surprise- LLActRep+ BwNot- ASPMOptComp+
                LnkCtl: ASPM Disabled; RCB 64 bytes, Disabled- CommClk+
                        ExtSynch- ClockPM- AutWidDis- BWInt- AutBWInt-
                LnkSta: Speed 8GT/s, Width x1
                        TrErr- Train- SlotClk+ DLActive+ BWMgmt- ABWMgmt-
                RootCap: CRSVisible-
                RootCtl: ErrCorrectable- ErrNon-Fatal- ErrFatal- PMEIntEna+ CRSVisible-
                RootSta: PME ReqID 0000, PMEStatus- PMEPending-
                DevCap2: Completion Timeout: Range ABCD, TimeoutDis+ NROPrPrP- LTR+
                         10BitTagComp+ 10BitTagReq- OBFF Via message, ExtFmt+ EETLPPrefix+, MaxEETLPPrefixes 1
                         EmergencyPowerReduction Not Supported, EmergencyPowerReductionInit-
                         FRS- LN System CLS Not Supported, TPHComp- ExtTPHComp- ARIFwd-
                         AtomicOpsCap: Routing+ 32bit+ 64bit+ 128bitCAS+
                DevCtl2: Completion Timeout: 50us to 50ms, TimeoutDis- LTR+ 10BitTagReq- OBFF Disabled, ARIFwd-
                         AtomicOpsCtl: ReqEn- EgressBlck-
                LnkCap2: Supported Link Speeds: 2.5-16GT/s, Crosslink- Retimer+ 2Retimers+ DRS-
                LnkCtl2: Target Link Speed: 16GT/s, EnterCompliance- SpeedDis-
                         Transmit Margin: Normal Operating Range, EnterModifiedCompliance- ComplianceSOS-
                         Compliance Preset/De-emphasis: -6dB de-emphasis, 0dB preshoot
                LnkSta2: Current De-emphasis Level: -6dB, EqualizationComplete+ EqualizationPhase1+
                         EqualizationPhase2+ EqualizationPhase3+ LinkEqualizationRequest-
                         Retimer- 2Retimers- CrosslinkRes: unsupported
        Capabilities: [100 v2] Advanced Error Reporting
                UESta:  DLP- SDES- TLP- FCP- CmpltTO- CmpltAbrt- UnxCmplt- RxOF- MalfTLP- ECRC- UnsupReq- ACSViol-
                UEMsk:  DLP- SDES- TLP- FCP- CmpltTO- CmpltAbrt- UnxCmplt- RxOF- MalfTLP- ECRC- UnsupReq- ACSViol-
                UESvrt: DLP+ SDES- TLP- FCP+ CmpltTO- CmpltAbrt- UnxCmplt- RxOF+ MalfTLP+ ECRC- UnsupReq- ACSViol-
                CESta:  RxErr- BadTLP- BadDLLP- Rollover- Timeout- AdvNonFatalErr-
                CEMsk:  RxErr- BadTLP- BadDLLP- Rollover- Timeout- AdvNonFatalErr+
                AERCap: First Error Pointer: 01, ECRCGenCap+ ECRCGenEn- ECRCChkCap+ ECRCChkEn-
                        MultHdrRecCap- MultHdrRecEn- TLPPfxPres- HdrLogCap-
                HeaderLog: 00000000 00000000 00000000 00000000
                RootCmd: CERptEn+ NFERptEn+ FERptEn+
                RootSta: CERcvd- MultCERcvd- UERcvd- MultUERcvd-
                         FirstFatal- NonFatalMsg- FatalMsg- IntMsg 0
                ErrorSrc: ERR_COR: 0000 ERR_FATAL/NONFATAL: 0000
        Capabilities: [150 v1] Device Serial Number 00-00-00-00-00-00-00-00
        Capabilities: [300 v1] Secondary PCI Express
                LnkCtl3: LnkEquIntrruptEn- PerformEqu-
                LaneErrStat: 0
        Capabilities: [4c0 v1] Virtual Channel
                Caps:   LPEVC=0 RefClk=100ns PATEntryBits=1
                Arb:    Fixed- WRR32- WRR64- WRR128-
                Ctrl:   ArbSelect=Fixed
                Status: InProgress-
                VC0:    Caps:   PATOffset=00 MaxTimeSlots=1 RejSnoopTrans-
                        Arb:    Fixed- WRR32- WRR64- WRR128- TWRR128- WRR256-
                        Ctrl:   Enable+ ID=0 ArbSelect=Fixed TC/VC=ff
                        Status: NegoPending- InProgress-
        Capabilities: [900 v1] L1 PM Substates
                L1SubCap: PCI-PM_L1.2+ PCI-PM_L1.1+ ASPM_L1.2+ ASPM_L1.1+ L1_PM_Substates+
                          PortCommonModeRestoreTime=0us PortTPowerOnTime=10us
                L1SubCtl1: PCI-PM_L1.2- PCI-PM_L1.1- ASPM_L1.2- ASPM_L1.1-
                           T_CommonMode=150us LTR1.2_Threshold=306176ns
                L1SubCtl2: T_PwrOn=150us
        Capabilities: [910 v1] Data Link Feature <?>
        Capabilities: [920 v1] Lane Margining at the Receiver <?>
        Capabilities: [9c0 v1] Physical Layer 16.0 GT/s <?>
        Capabilities: [a20 v1] Precision Time Measurement
                PTMCap: Requester:- Responder:+ Root:+
                PTMClockGranularity: 2ns
                PTMControl: Enabled:- RootSelected:-
                PTMEffectiveGranularity: Unknown
        Capabilities: [a90 v1] Extended Capability ID 0x2f
        Kernel driver in use: pcieport

31:00.0 Ethernet controller: Realtek Semiconductor Co., Ltd. RTL8126 5GbE Controller (rev 01)
        Subsystem: Realtek Semiconductor Co., Ltd. RTL8126 5GbE Controller
        Control: I/O+ Mem+ BusMaster+ SpecCycle- MemWINV- VGASnoop- ParErr- Stepping- SERR- FastB2B- DisINTx+
        Status: Cap+ 66MHz- UDF- FastB2B- ParErr- DEVSEL=fast >TAbort- <TAbort- <MAbort- >SERR- <PERR- INTx-
        Latency: 0, Cache Line Size: 64 bytes
        Interrupt: pin A routed to IRQ 139
        IOMMU group: 2
        Region 0: I/O ports at 200000 [size=256]
        Region 2: Memory at 38300000 (64-bit, non-prefetchable) [size=64K]
        Region 4: Memory at 38310000 (64-bit, non-prefetchable) [size=16K]
        Capabilities: [40] Power Management version 3
                Flags: PMEClk- DSI- D1+ D2+ AuxCurrent=375mA PME(D0+,D1+,D2+,D3hot+,D3cold+)
                Status: D0 NoSoftRst+ PME-Enable- DSel=0 DScale=0 PME-
        Capabilities: [50] MSI: Enable- Count=1/1 Maskable+ 64bit+
                Address: 0000000000000000  Data: 0000
                Masking: 00000000  Pending: 00000000
        Capabilities: [70] Express (v2) Endpoint, MSI 01
                DevCap: MaxPayload 512 bytes, PhantFunc 0, Latency L0s <512ns, L1 <64us
                        ExtTag- AttnBtn- AttnInd- PwrInd- RBE+ FLReset- SlotPowerLimit 0W
                DevCtl: CorrErr+ NonFatalErr+ FatalErr+ UnsupReq+
                        RlxdOrd+ ExtTag- PhantFunc- AuxPwr- NoSnoop-
                        MaxPayload 512 bytes, MaxReadReq 512 bytes
                DevSta: CorrErr- NonFatalErr- FatalErr- UnsupReq- AuxPwr+ TransPend-
                LnkCap: Port #0, Speed 8GT/s, Width x1, ASPM L0s L1, Exit Latency L0s unlimited, L1 <64us
                        ClockPM+ Surprise- LLActRep- BwNot- ASPMOptComp+
                LnkCtl: ASPM Disabled; RCB 64 bytes, Disabled- CommClk+
                        ExtSynch- ClockPM- AutWidDis- BWInt- AutBWInt-
                LnkSta: Speed 8GT/s, Width x1
                        TrErr- Train- SlotClk+ DLActive- BWMgmt- ABWMgmt-
                DevCap2: Completion Timeout: Range ABCD, TimeoutDis+ NROPrPrP- LTR+
                         10BitTagComp- 10BitTagReq- OBFF Via message/WAKE#, ExtFmt- EETLPPrefix-
                         EmergencyPowerReduction Not Supported, EmergencyPowerReductionInit-
                         FRS- TPHComp+ ExtTPHComp-
                         AtomicOpsCap: 32bit- 64bit- 128bitCAS-
                DevCtl2: Completion Timeout: 50us to 50ms, TimeoutDis- LTR+ 10BitTagReq- OBFF Disabled,
                         AtomicOpsCtl: ReqEn-
                LnkCap2: Supported Link Speeds: 2.5-8GT/s, Crosslink- Retimer- 2Retimers- DRS-
                LnkCtl2: Target Link Speed: 8GT/s, EnterCompliance- SpeedDis-
                         Transmit Margin: Normal Operating Range, EnterModifiedCompliance- ComplianceSOS-
                         Compliance Preset/De-emphasis: -6dB de-emphasis, 0dB preshoot
                LnkSta2: Current De-emphasis Level: -6dB, EqualizationComplete+ EqualizationPhase1+
                         EqualizationPhase2+ EqualizationPhase3+ LinkEqualizationRequest-
                         Retimer- 2Retimers- CrosslinkRes: unsupported
        Capabilities: [b0] MSI-X: Enable+ Count=32 Masked-
                Vector table: BAR=4 offset=00000000
                PBA: BAR=4 offset=00000800
        Capabilities: [d0] Vital Product Data
pcilib: sysfs_read_vpd: read failed: No such device
                Not readable
        Capabilities: [100 v2] Advanced Error Reporting
                UESta:  DLP- SDES- TLP- FCP- CmpltTO- CmpltAbrt- UnxCmplt- RxOF- MalfTLP- ECRC- UnsupReq- ACSViol-
                UEMsk:  DLP- SDES- TLP- FCP- CmpltTO- CmpltAbrt- UnxCmplt- RxOF- MalfTLP- ECRC- UnsupReq+ ACSViol-
                UESvrt: DLP+ SDES+ TLP- FCP+ CmpltTO- CmpltAbrt- UnxCmplt- RxOF+ MalfTLP+ ECRC- UnsupReq- ACSViol-
                CESta:  RxErr- BadTLP- BadDLLP- Rollover- Timeout- AdvNonFatalErr-
                CEMsk:  RxErr- BadTLP- BadDLLP- Rollover- Timeout- AdvNonFatalErr+
                AERCap: First Error Pointer: 00, ECRCGenCap+ ECRCGenEn- ECRCChkCap+ ECRCChkEn-
                        MultHdrRecCap- MultHdrRecEn- TLPPfxPres- HdrLogCap-
                HeaderLog: 00000000 00000000 00000000 00000000
        Capabilities: [148 v1] Virtual Channel
                Caps:   LPEVC=0 RefClk=100ns PATEntryBits=1
                Arb:    Fixed- WRR32- WRR64- WRR128-
                Ctrl:   ArbSelect=Fixed
                Status: InProgress-
                VC0:    Caps:   PATOffset=00 MaxTimeSlots=1 RejSnoopTrans-
                        Arb:    Fixed- WRR32- WRR64- WRR128- TWRR128- WRR256-
                        Ctrl:   Enable+ ID=0 ArbSelect=Fixed TC/VC=ff
                        Status: NegoPending- InProgress-
        Capabilities: [170 v1] Device Serial Number 01-00-00-00-68-4c-e0-00
        Capabilities: [180 v1] Secondary PCI Express
                LnkCtl3: LnkEquIntrruptEn- PerformEqu-
                LaneErrStat: 0
        Capabilities: [190 v1] Transaction Processing Hints
                No steering table available
        Capabilities: [21c v1] Latency Tolerance Reporting
                Max snoop latency: 0ns
                Max no snoop latency: 0ns
        Capabilities: [224 v1] L1 PM Substates
                L1SubCap: PCI-PM_L1.2+ PCI-PM_L1.1+ ASPM_L1.2+ ASPM_L1.1+ L1_PM_Substates+
                          PortCommonModeRestoreTime=150us PortTPowerOnTime=150us
                L1SubCtl1: PCI-PM_L1.2- PCI-PM_L1.1- ASPM_L1.2- ASPM_L1.1-
                           T_CommonMode=0us LTR1.2_Threshold=306176ns
                L1SubCtl2: T_PwrOn=150us
        Capabilities: [234 v1] Vendor Specific Information: ID=0002 Rev=4 Len=100 <?>
        Kernel driver in use: r8126
        Kernel modules: r8126

90:00.0 PCI bridge: CIX Technology Group Co., Ltd. CIX P1 CD8180 PCI Express Root Port (prog-if 00 [Normal decode])
        Control: I/O- Mem+ BusMaster+ SpecCycle- MemWINV- VGASnoop- ParErr- Stepping- SERR- FastB2B- DisINTx+
        Status: Cap+ 66MHz- UDF- FastB2B- ParErr- DEVSEL=fast >TAbort- <TAbort- <MAbort- >SERR- <PERR- INTx-
        Latency: 0
        Interrupt: pin A routed to IRQ 137
        IOMMU group: 0
        Bus: primary=90, secondary=91, subordinate=bf, sec-latency=0
        I/O behind bridge: 0000f000-00000fff [disabled] [32-bit]
        Memory behind bridge: 50300000-503fffff [size=1M] [32-bit]
        Prefetchable memory behind bridge: 00000000fff00000-00000000000fffff [disabled] [64-bit]
        Secondary status: 66MHz- FastB2B- ParErr- DEVSEL=fast >TAbort- <TAbort- <MAbort- <SERR- <PERR-
        Expansion ROM at 50200000 [virtual] [disabled] [size=1M]
        BridgeCtl: Parity- SERR+ NoISA- VGA- VGA16- MAbort- >Reset- FastB2B-
                PriDiscTmr- SecDiscTmr- DiscTmrStat- DiscTmrSERREn-
        Capabilities: [80] Power Management version 3
                Flags: PMEClk- DSI- D1+ D2- AuxCurrent=0mA PME(D0+,D1+,D2-,D3hot+,D3cold-)
                Status: D0 NoSoftRst+ PME-Enable- DSel=0 DScale=0 PME-
        Capabilities: [90] MSI: Enable+ Count=1/32 Maskable+ 64bit+
                Address: 00000000fffff040  Data: 0000
                Masking: fffffffe  Pending: 00000000
        Capabilities: [b0] MSI-X: Enable- Count=2 Masked-
                Vector table: BAR=0 offset=00000040
                PBA: BAR=0 offset=00000040
        Capabilities: [c0] Express (v2) Root Port (Slot-), MSI 00
                DevCap: MaxPayload 512 bytes, PhantFunc 0
                        ExtTag- RBE+
                DevCtl: CorrErr+ NonFatalErr+ FatalErr+ UnsupReq+
                        RlxdOrd+ ExtTag- PhantFunc- AuxPwr- NoSnoop+
                        MaxPayload 512 bytes, MaxReadReq 1024 bytes
                DevSta: CorrErr- NonFatalErr- FatalErr- UnsupReq- AuxPwr- TransPend-
                LnkCap: Port #0, Speed 16GT/s, Width x4, ASPM L0s L1, Exit Latency L0s <256ns, L1 <8us
                        ClockPM- Surprise- LLActRep+ BwNot- ASPMOptComp+
                LnkCtl: ASPM Disabled; RCB 64 bytes, Disabled- CommClk+
                        ExtSynch- ClockPM- AutWidDis- BWInt- AutBWInt-
                LnkSta: Speed 16GT/s, Width x4
                        TrErr- Train- SlotClk+ DLActive+ BWMgmt- ABWMgmt-
                RootCap: CRSVisible-
                RootCtl: ErrCorrectable- ErrNon-Fatal- ErrFatal- PMEIntEna+ CRSVisible-
                RootSta: PME ReqID 0000, PMEStatus- PMEPending-
                DevCap2: Completion Timeout: Range ABCD, TimeoutDis+ NROPrPrP- LTR+
                         10BitTagComp+ 10BitTagReq- OBFF Via message, ExtFmt+ EETLPPrefix+, MaxEETLPPrefixes 1
                         EmergencyPowerReduction Not Supported, EmergencyPowerReductionInit-
                         FRS- LN System CLS Not Supported, TPHComp- ExtTPHComp- ARIFwd-
                         AtomicOpsCap: Routing+ 32bit+ 64bit+ 128bitCAS+
                DevCtl2: Completion Timeout: 50us to 50ms, TimeoutDis- LTR+ 10BitTagReq- OBFF Disabled, ARIFwd-
                         AtomicOpsCtl: ReqEn- EgressBlck-
                LnkCap2: Supported Link Speeds: 2.5-16GT/s, Crosslink- Retimer+ 2Retimers+ DRS-
                LnkCtl2: Target Link Speed: 16GT/s, EnterCompliance- SpeedDis-
                         Transmit Margin: Normal Operating Range, EnterModifiedCompliance- ComplianceSOS-
                         Compliance Preset/De-emphasis: -6dB de-emphasis, 0dB preshoot
                LnkSta2: Current De-emphasis Level: -6dB, EqualizationComplete+ EqualizationPhase1+
                         EqualizationPhase2+ EqualizationPhase3+ LinkEqualizationRequest-
                         Retimer- 2Retimers- CrosslinkRes: unsupported
        Capabilities: [100 v2] Advanced Error Reporting
                UESta:  DLP- SDES- TLP- FCP- CmpltTO- CmpltAbrt- UnxCmplt- RxOF- MalfTLP- ECRC- UnsupReq- ACSViol-
                UEMsk:  DLP- SDES- TLP- FCP- CmpltTO- CmpltAbrt- UnxCmplt- RxOF- MalfTLP- ECRC- UnsupReq- ACSViol-
                UESvrt: DLP+ SDES- TLP- FCP+ CmpltTO- CmpltAbrt- UnxCmplt- RxOF+ MalfTLP+ ECRC- UnsupReq- ACSViol-
                CESta:  RxErr- BadTLP- BadDLLP- Rollover- Timeout- AdvNonFatalErr-
                CEMsk:  RxErr- BadTLP- BadDLLP- Rollover- Timeout- AdvNonFatalErr+
                AERCap: First Error Pointer: 01, ECRCGenCap+ ECRCGenEn- ECRCChkCap+ ECRCChkEn-
                        MultHdrRecCap- MultHdrRecEn- TLPPfxPres- HdrLogCap-
                HeaderLog: 00000000 00000000 00000000 00000000
                RootCmd: CERptEn+ NFERptEn+ FERptEn+
                RootSta: CERcvd- MultCERcvd- UERcvd- MultUERcvd-
                         FirstFatal- NonFatalMsg- FatalMsg- IntMsg 0
                ErrorSrc: ERR_COR: 0000 ERR_FATAL/NONFATAL: 0000
        Capabilities: [150 v1] Device Serial Number 00-00-00-00-00-00-00-00
        Capabilities: [300 v1] Secondary PCI Express
                LnkCtl3: LnkEquIntrruptEn- PerformEqu-
                LaneErrStat: 0
        Capabilities: [4c0 v1] Virtual Channel
                Caps:   LPEVC=0 RefClk=100ns PATEntryBits=1
                Arb:    Fixed- WRR32- WRR64- WRR128-
                Ctrl:   ArbSelect=Fixed
                Status: InProgress-
                VC0:    Caps:   PATOffset=00 MaxTimeSlots=1 RejSnoopTrans-
                        Arb:    Fixed- WRR32- WRR64- WRR128- TWRR128- WRR256-
                        Ctrl:   Enable+ ID=0 ArbSelect=Fixed TC/VC=ff
                        Status: NegoPending- InProgress-
        Capabilities: [900 v1] L1 PM Substates
                L1SubCap: PCI-PM_L1.2+ PCI-PM_L1.1+ ASPM_L1.2+ ASPM_L1.1+ L1_PM_Substates+
                          PortCommonModeRestoreTime=0us PortTPowerOnTime=10us
                L1SubCtl1: PCI-PM_L1.2- PCI-PM_L1.1- ASPM_L1.2- ASPM_L1.1-
                           T_CommonMode=10us LTR1.2_Threshold=26016ns
                L1SubCtl2: T_PwrOn=10us
        Capabilities: [910 v1] Data Link Feature <?>
        Capabilities: [920 v1] Lane Margining at the Receiver <?>
        Capabilities: [9c0 v1] Physical Layer 16.0 GT/s <?>
        Capabilities: [a20 v1] Precision Time Measurement
                PTMCap: Requester:- Responder:+ Root:+
                PTMClockGranularity: 2ns
                PTMControl: Enabled:- RootSelected:-
                PTMEffectiveGranularity: Unknown
        Capabilities: [a90 v1] Extended Capability ID 0x2f
        Kernel driver in use: pcieport

91:00.0 Non-Volatile memory controller: Samsung Electronics Co Ltd NVMe SSD Controller PM9C1a (DRAM-less) (prog-if 02 [NVM Express])
        Subsystem: Samsung Electronics Co Ltd NVMe SSD Controller PM9C1a (DRAM-less)
        Control: I/O- Mem+ BusMaster+ SpecCycle- MemWINV- VGASnoop- ParErr- Stepping- SERR- FastB2B- DisINTx+
        Status: Cap+ 66MHz- UDF- FastB2B- ParErr- DEVSEL=fast >TAbort- <TAbort- <MAbort- >SERR- <PERR- INTx-
        Latency: 0
        Interrupt: pin A routed to IRQ 136
        IOMMU group: 0
        Region 0: Memory at 50300000 (64-bit, non-prefetchable) [size=16K]
        Capabilities: [40] Power Management version 3
                Flags: PMEClk- DSI- D1- D2- AuxCurrent=0mA PME(D0-,D1-,D2-,D3hot-,D3cold-)
                Status: D0 NoSoftRst+ PME-Enable- DSel=0 DScale=0 PME-
        Capabilities: [50] MSI: Enable- Count=1/16 Maskable- 64bit+
                Address: 0000000000000000  Data: 0000
        Capabilities: [70] Express (v2) Endpoint, MSI 00
                DevCap: MaxPayload 512 bytes, PhantFunc 0, Latency L0s unlimited, L1 unlimited
                        ExtTag+ AttnBtn- AttnInd- PwrInd- RBE+ FLReset+ SlotPowerLimit 0W
                DevCtl: CorrErr+ NonFatalErr+ FatalErr+ UnsupReq+
                        RlxdOrd+ ExtTag+ PhantFunc- AuxPwr- NoSnoop+ FLReset-
                        MaxPayload 512 bytes, MaxReadReq 512 bytes
                DevSta: CorrErr- NonFatalErr- FatalErr- UnsupReq- AuxPwr- TransPend-
                LnkCap: Port #0, Speed 16GT/s, Width x4, ASPM L1, Exit Latency L1 <64us
                        ClockPM+ Surprise- LLActRep- BwNot- ASPMOptComp+
                LnkCtl: ASPM Disabled; RCB 64 bytes, Disabled- CommClk+
                        ExtSynch- ClockPM- AutWidDis- BWInt- AutBWInt-
                LnkSta: Speed 16GT/s, Width x4
                        TrErr- Train- SlotClk+ DLActive- BWMgmt- ABWMgmt-
                DevCap2: Completion Timeout: Range ABCD, TimeoutDis+ NROPrPrP- LTR+
                         10BitTagComp+ 10BitTagReq- OBFF Not Supported, ExtFmt- EETLPPrefix-
                         EmergencyPowerReduction Not Supported, EmergencyPowerReductionInit-
                         FRS- TPHComp- ExtTPHComp-
                         AtomicOpsCap: 32bit- 64bit- 128bitCAS-
                DevCtl2: Completion Timeout: 50us to 50ms, TimeoutDis- LTR+ 10BitTagReq- OBFF Disabled,
                         AtomicOpsCtl: ReqEn-
                LnkCap2: Supported Link Speeds: 2.5-16GT/s, Crosslink- Retimer+ 2Retimers+ DRS-
                LnkCtl2: Target Link Speed: 16GT/s, EnterCompliance- SpeedDis-
                         Transmit Margin: Normal Operating Range, EnterModifiedCompliance- ComplianceSOS-
                         Compliance Preset/De-emphasis: -6dB de-emphasis, 0dB preshoot
                LnkSta2: Current De-emphasis Level: -6dB, EqualizationComplete+ EqualizationPhase1+
                         EqualizationPhase2+ EqualizationPhase3+ LinkEqualizationRequest-
                         Retimer- 2Retimers- CrosslinkRes: Upstream Port
        Capabilities: [b0] MSI-X: Enable+ Count=17 Masked-
                Vector table: BAR=0 offset=00003000
                PBA: BAR=0 offset=00002000
        Capabilities: [100 v2] Advanced Error Reporting
                UESta:  DLP- SDES- TLP- FCP- CmpltTO- CmpltAbrt- UnxCmplt- RxOF- MalfTLP- ECRC- UnsupReq- ACSViol-
                UEMsk:  DLP- SDES- TLP- FCP- CmpltTO- CmpltAbrt- UnxCmplt- RxOF- MalfTLP- ECRC- UnsupReq- ACSViol-
                UESvrt: DLP+ SDES+ TLP- FCP+ CmpltTO- CmpltAbrt- UnxCmplt- RxOF+ MalfTLP+ ECRC- UnsupReq- ACSViol-
                CESta:  RxErr- BadTLP- BadDLLP- Rollover- Timeout- AdvNonFatalErr-
                CEMsk:  RxErr- BadTLP- BadDLLP- Rollover- Timeout- AdvNonFatalErr+
                AERCap: First Error Pointer: 00, ECRCGenCap+ ECRCGenEn- ECRCChkCap+ ECRCChkEn-
                        MultHdrRecCap+ MultHdrRecEn- TLPPfxPres- HdrLogCap-
                HeaderLog: 00000000 00000000 00000000 00000000
        Capabilities: [168 v1] Secondary PCI Express
                LnkCtl3: LnkEquIntrruptEn- PerformEqu-
                LaneErrStat: 0
        Capabilities: [188 v1] Physical Layer 16.0 GT/s <?>
        Capabilities: [1ac v1] Lane Margining at the Receiver <?>
        Capabilities: [1c4 v1] Extended Capability ID 0x2a
        Capabilities: [1e8 v1] Latency Tolerance Reporting
                Max snoop latency: 0ns
                Max no snoop latency: 0ns
        Capabilities: [1f0 v1] L1 PM Substates
                L1SubCap: PCI-PM_L1.2+ PCI-PM_L1.1+ ASPM_L1.2+ ASPM_L1.1+ L1_PM_Substates+
                          PortCommonModeRestoreTime=10us PortTPowerOnTime=10us
                L1SubCtl1: PCI-PM_L1.2- PCI-PM_L1.1- ASPM_L1.2- ASPM_L1.1-
                           T_CommonMode=0us LTR1.2_Threshold=26016ns
                L1SubCtl2: T_PwrOn=10us
        Capabilities: [374 v1] Data Link Feature <?>
        Kernel driver in use: nvme

c0:00.0 PCI bridge: CIX Technology Group Co., Ltd. CIX P1 CD8180 PCI Express Root Port (prog-if 00 [Normal decode])
        Control: I/O- Mem+ BusMaster+ SpecCycle- MemWINV- VGASnoop- ParErr- Stepping- SERR- FastB2B- DisINTx+
        Status: Cap+ 66MHz- UDF- FastB2B- ParErr- DEVSEL=fast >TAbort- <TAbort- <MAbort+ >SERR- <PERR- INTx-
        Latency: 0
        Interrupt: pin A routed to IRQ 138
        IOMMU group: 1
        Bus: primary=c0, secondary=c1, subordinate=ff, sec-latency=0
        I/O behind bridge: 0000f000-00000fff [disabled] [32-bit]
        Memory behind bridge: 60300000-604fffff [size=2M] [32-bit]
        Prefetchable memory behind bridge: 1800000000-1813ffffff [size=320M] [32-bit]
        Secondary status: 66MHz- FastB2B- ParErr- DEVSEL=fast >TAbort- <TAbort- <MAbort- <SERR- <PERR-
        Expansion ROM at 60200000 [virtual] [disabled] [size=1M]
        BridgeCtl: Parity- SERR+ NoISA- VGA- VGA16- MAbort- >Reset- FastB2B-
                PriDiscTmr- SecDiscTmr- DiscTmrStat- DiscTmrSERREn-
        Capabilities: [80] Power Management version 3
                Flags: PMEClk- DSI- D1+ D2- AuxCurrent=0mA PME(D0+,D1+,D2-,D3hot+,D3cold-)
                Status: D0 NoSoftRst+ PME-Enable- DSel=0 DScale=0 PME-
        Capabilities: [90] MSI: Enable+ Count=1/32 Maskable+ 64bit+
                Address: 00000000fffff040  Data: 0000
                Masking: fffffffe  Pending: 00000000
        Capabilities: [b0] MSI-X: Enable- Count=2 Masked-
                Vector table: BAR=0 offset=00000040
                PBA: BAR=0 offset=00000040
        Capabilities: [c0] Express (v2) Root Port (Slot-), MSI 00
                DevCap: MaxPayload 512 bytes, PhantFunc 0
                        ExtTag+ RBE+
                DevCtl: CorrErr+ NonFatalErr+ FatalErr+ UnsupReq+
                        RlxdOrd+ ExtTag+ PhantFunc- AuxPwr- NoSnoop+
                        MaxPayload 512 bytes, MaxReadReq 1024 bytes
                DevSta: CorrErr- NonFatalErr- FatalErr- UnsupReq- AuxPwr- TransPend-
                LnkCap: Port #0, Speed 16GT/s, Width x8, ASPM L0s L1, Exit Latency L0s <256ns, L1 <8us
                        ClockPM- Surprise- LLActRep+ BwNot- ASPMOptComp+
                LnkCtl: ASPM Disabled; RCB 64 bytes, Disabled- CommClk-
                        ExtSynch- ClockPM- AutWidDis- BWInt- AutBWInt-
                LnkSta: Speed 16GT/s, Width x8
                        TrErr- Train- SlotClk+ DLActive+ BWMgmt- ABWMgmt-
                RootCap: CRSVisible-
                RootCtl: ErrCorrectable- ErrNon-Fatal- ErrFatal- PMEIntEna+ CRSVisible-
                RootSta: PME ReqID 0000, PMEStatus- PMEPending-
                DevCap2: Completion Timeout: Range ABCD, TimeoutDis+ NROPrPrP- LTR+
                         10BitTagComp+ 10BitTagReq- OBFF Via message, ExtFmt+ EETLPPrefix+, MaxEETLPPrefixes 1
                         EmergencyPowerReduction Not Supported, EmergencyPowerReductionInit-
                         FRS- LN System CLS Not Supported, TPHComp- ExtTPHComp- ARIFwd-
                         AtomicOpsCap: Routing+ 32bit+ 64bit+ 128bitCAS+
                DevCtl2: Completion Timeout: 50us to 50ms, TimeoutDis- LTR+ 10BitTagReq- OBFF Disabled, ARIFwd-
                         AtomicOpsCtl: ReqEn- EgressBlck-
                LnkCap2: Supported Link Speeds: 2.5-16GT/s, Crosslink- Retimer+ 2Retimers+ DRS-
                LnkCtl2: Target Link Speed: 16GT/s, EnterCompliance- SpeedDis-
                         Transmit Margin: Normal Operating Range, EnterModifiedCompliance- ComplianceSOS-
                         Compliance Preset/De-emphasis: -6dB de-emphasis, 0dB preshoot
                LnkSta2: Current De-emphasis Level: -6dB, EqualizationComplete+ EqualizationPhase1+
                         EqualizationPhase2+ EqualizationPhase3+ LinkEqualizationRequest-
                         Retimer- 2Retimers- CrosslinkRes: unsupported
        Capabilities: [100 v2] Advanced Error Reporting
                UESta:  DLP- SDES- TLP- FCP- CmpltTO- CmpltAbrt- UnxCmplt- RxOF- MalfTLP- ECRC- UnsupReq- ACSViol-
                UEMsk:  DLP- SDES- TLP- FCP- CmpltTO- CmpltAbrt- UnxCmplt- RxOF- MalfTLP- ECRC- UnsupReq- ACSViol-
                UESvrt: DLP+ SDES- TLP- FCP+ CmpltTO- CmpltAbrt- UnxCmplt- RxOF+ MalfTLP+ ECRC- UnsupReq- ACSViol-
                CESta:  RxErr- BadTLP- BadDLLP- Rollover- Timeout- AdvNonFatalErr-
                CEMsk:  RxErr- BadTLP- BadDLLP- Rollover- Timeout- AdvNonFatalErr+
                AERCap: First Error Pointer: 01, ECRCGenCap+ ECRCGenEn- ECRCChkCap+ ECRCChkEn-
                        MultHdrRecCap- MultHdrRecEn- TLPPfxPres- HdrLogCap-
                HeaderLog: 00000000 00000000 00000000 00000000
                RootCmd: CERptEn+ NFERptEn+ FERptEn+
                RootSta: CERcvd- MultCERcvd- UERcvd- MultUERcvd-
                         FirstFatal- NonFatalMsg- FatalMsg- IntMsg 0
                ErrorSrc: ERR_COR: 0000 ERR_FATAL/NONFATAL: 0000
        Capabilities: [150 v1] Device Serial Number 00-00-00-00-00-00-00-00
        Capabilities: [300 v1] Secondary PCI Express
                LnkCtl3: LnkEquIntrruptEn- PerformEqu-
                LaneErrStat: 0
        Capabilities: [4c0 v1] Virtual Channel
                Caps:   LPEVC=0 RefClk=100ns PATEntryBits=1
                Arb:    Fixed- WRR32- WRR64- WRR128-
                Ctrl:   ArbSelect=Fixed
                Status: InProgress-
                VC0:    Caps:   PATOffset=00 MaxTimeSlots=1 RejSnoopTrans-
                        Arb:    Fixed- WRR32- WRR64- WRR128- TWRR128- WRR256-
                        Ctrl:   Enable+ ID=0 ArbSelect=Fixed TC/VC=ff
                        Status: NegoPending- InProgress-
        Capabilities: [900 v1] L1 PM Substates
                L1SubCap: PCI-PM_L1.2+ PCI-PM_L1.1+ ASPM_L1.2+ ASPM_L1.1+ L1_PM_Substates+
                          PortCommonModeRestoreTime=0us PortTPowerOnTime=10us
                L1SubCtl1: PCI-PM_L1.2- PCI-PM_L1.1- ASPM_L1.2- ASPM_L1.1-
                           T_CommonMode=0us LTR1.2_Threshold=0ns
                L1SubCtl2: T_PwrOn=10us
        Capabilities: [910 v1] Data Link Feature <?>
        Capabilities: [920 v1] Lane Margining at the Receiver <?>
        Capabilities: [9c0 v1] Physical Layer 16.0 GT/s <?>
        Capabilities: [a20 v1] Precision Time Measurement
                PTMCap: Requester:- Responder:+ Root:+
                PTMClockGranularity: 2ns
                PTMControl: Enabled:- RootSelected:-
                PTMEffectiveGranularity: Unknown
        Capabilities: [a90 v1] Extended Capability ID 0x2f
        Kernel driver in use: pcieport

c1:00.0 Ethernet controller: Mellanox Technologies MT28800 Family [ConnectX-5 Ex]
        Subsystem: Mellanox Technologies ConnectX-5 Ex EN network interface card, 100GbE dual-port QSFP28, PCIe4.0 x16, tall bracket; MCX516A-CDAT
        Control: I/O- Mem- BusMaster- SpecCycle- MemWINV- VGASnoop- ParErr- Stepping- SERR- FastB2B- DisINTx-
        Status: Cap+ 66MHz- UDF- FastB2B- ParErr- DEVSEL=fast >TAbort- <TAbort- <MAbort- >SERR- <PERR- INTx-
        Interrupt: pin A routed to IRQ 0
        Region 0: Memory at 1800000000 (64-bit, prefetchable) [disabled] [size=32M]
        Expansion ROM at 60300000 [virtual] [disabled] [size=1M]
        Capabilities: [60] Express (v2) Endpoint, MSI 00
                DevCap: MaxPayload 512 bytes, PhantFunc 0, Latency L0s unlimited, L1 unlimited
                        ExtTag+ AttnBtn- AttnInd- PwrInd- RBE+ FLReset+ SlotPowerLimit 0W
                DevCtl: CorrErr+ NonFatalErr+ FatalErr+ UnsupReq+
                        RlxdOrd+ ExtTag+ PhantFunc- AuxPwr- NoSnoop+ FLReset-
                        MaxPayload 512 bytes, MaxReadReq 512 bytes
                DevSta: CorrErr+ NonFatalErr- FatalErr- UnsupReq+ AuxPwr- TransPend-
                LnkCap: Port #0, Speed 16GT/s, Width x16, ASPM not supported
                        ClockPM- Surprise- LLActRep- BwNot- ASPMOptComp+
                LnkCtl: ASPM Disabled; RCB 64 bytes, Disabled- CommClk-
                        ExtSynch- ClockPM- AutWidDis- BWInt- AutBWInt-
                LnkSta: Speed 16GT/s, Width x8 (downgraded)
                        TrErr- Train- SlotClk+ DLActive- BWMgmt- ABWMgmt-
                DevCap2: Completion Timeout: Range ABC, TimeoutDis+ NROPrPrP- LTR-
                         10BitTagComp+ 10BitTagReq- OBFF Not Supported, ExtFmt- EETLPPrefix-
                         EmergencyPowerReduction Not Supported, EmergencyPowerReductionInit-
                         FRS- TPHComp- ExtTPHComp-
                         AtomicOpsCap: 32bit- 64bit- 128bitCAS-
                DevCtl2: Completion Timeout: 50us to 50ms, TimeoutDis- LTR- 10BitTagReq- OBFF Disabled,
                         AtomicOpsCtl: ReqEn-
                LnkCap2: Supported Link Speeds: 2.5-16GT/s, Crosslink- Retimer+ 2Retimers+ DRS-
                LnkCtl2: Target Link Speed: 16GT/s, EnterCompliance- SpeedDis-
                         Transmit Margin: Normal Operating Range, EnterModifiedCompliance- ComplianceSOS-
                         Compliance Preset/De-emphasis: -6dB de-emphasis, 0dB preshoot
                LnkSta2: Current De-emphasis Level: -6dB, EqualizationComplete+ EqualizationPhase1+
                         EqualizationPhase2+ EqualizationPhase3+ LinkEqualizationRequest-
                         Retimer- 2Retimers- CrosslinkRes: unsupported
        Capabilities: [48] Vital Product Data
                Product Name: CX516A - ConnectX-5 QSFP28
                Read-only fields:
                        [PN] Part number: MCX516A-CDAT    
                        [EC] Engineering changes: AA
                        [V2] Vendor specific: MCX516A-CDAT    
                        [SN] Serial number: MT2017X21701          
                        [V3] Vendor specific: f0ff9ba3728aea1180000c42a16a9448
                        [VA] Vendor specific: MLX:MODL=CX516A:MN=MLNX:CSKU=V2:UUID=V3:PCI=V0
                        [V0] Vendor specific: PCIeGen4 x16
                        [RV] Reserved: checksum good, 2 byte(s) reserved
                End
        Capabilities: [9c] MSI-X: Enable- Count=64 Masked-
                Vector table: BAR=0 offset=00002000
                PBA: BAR=0 offset=00003000
        Capabilities: [c0] Vendor Specific Information: Len=18 <?>
        Capabilities: [40] Power Management version 3
                Flags: PMEClk- DSI- D1- D2- AuxCurrent=375mA PME(D0-,D1-,D2-,D3hot-,D3cold+)
                Status: D0 NoSoftRst+ PME-Enable- DSel=0 DScale=0 PME-
        Capabilities: [100 v1] Advanced Error Reporting
                UESta:  DLP- SDES- TLP- FCP- CmpltTO- CmpltAbrt- UnxCmplt- RxOF- MalfTLP- ECRC- UnsupReq- ACSViol-
                UEMsk:  DLP- SDES- TLP- FCP- CmpltTO- CmpltAbrt- UnxCmplt- RxOF- MalfTLP- ECRC- UnsupReq- ACSViol-
                UESvrt: DLP+ SDES- TLP- FCP+ CmpltTO- CmpltAbrt- UnxCmplt- RxOF+ MalfTLP+ ECRC- UnsupReq- ACSViol-
                CESta:  RxErr- BadTLP- BadDLLP- Rollover- Timeout- AdvNonFatalErr+
                CEMsk:  RxErr- BadTLP- BadDLLP- Rollover- Timeout- AdvNonFatalErr+
                AERCap: First Error Pointer: 04, ECRCGenCap+ ECRCGenEn- ECRCChkCap+ ECRCChkEn-
                        MultHdrRecCap- MultHdrRecEn- TLPPfxPres- HdrLogCap-
                HeaderLog: 00000000 00000000 00000000 00000000
        Capabilities: [150 v1] Alternative Routing-ID Interpretation (ARI)
                ARICap: MFVC- ACS-, Next Function: 1
                ARICtl: MFVC- ACS-, Function Group: 0
        Capabilities: [180 v1] Single Root I/O Virtualization (SR-IOV)
                IOVCap: Migration- 10BitTagReq- Interrupt Message Number: 000
                IOVCtl: Enable- Migration- Interrupt- MSE- ARIHierarchy- 10BitTagReq-
                IOVSta: Migration-
                Initial VFs: 64, Total VFs: 64, Number of VFs: 0, Function Dependency Link: 00
                VF offset: 2, stride: 1, Device ID: 101a
                Supported Page Size: 000007ff, System Page Size: 00000001
                Region 0: Memory at 0000001804000000 (64-bit, prefetchable)
                VF Migration: offset: 00000000, BIR: 0
        Capabilities: [1c0 v1] Secondary PCI Express
                LnkCtl3: LnkEquIntrruptEn- PerformEqu-
                LaneErrStat: 0
        Capabilities: [230 v1] Access Control Services
                ACSCap: SrcValid- TransBlk- ReqRedir- CmpltRedir- UpstreamFwd- EgressCtrl- DirectTrans-
                ACSCtl: SrcValid- TransBlk- ReqRedir- CmpltRedir- UpstreamFwd- EgressCtrl- DirectTrans-
        Capabilities: [320 v1] Lane Margining at the Receiver <?>
        Capabilities: [370 v1] Physical Layer 16.0 GT/s <?>
        Capabilities: [420 v1] Data Link Feature <?>

c1:00.1 Ethernet controller: Mellanox Technologies MT28800 Family [ConnectX-5 Ex]
        Subsystem: Mellanox Technologies ConnectX-5 Ex EN network interface card, 100GbE dual-port QSFP28, PCIe4.0 x16, tall bracket; MCX516A-CDAT
        Control: I/O- Mem- BusMaster- SpecCycle- MemWINV- VGASnoop- ParErr- Stepping- SERR- FastB2B- DisINTx-
        Status: Cap+ 66MHz- UDF- FastB2B- ParErr- DEVSEL=fast >TAbort- <TAbort- <MAbort- >SERR- <PERR- INTx-
        Interrupt: pin B routed to IRQ 0
        Region 0: Memory at 1802000000 (64-bit, prefetchable) [disabled] [size=32M]
        Expansion ROM at 60400000 [virtual] [disabled] [size=1M]
        Capabilities: [60] Express (v2) Endpoint, MSI 00
                DevCap: MaxPayload 512 bytes, PhantFunc 0, Latency L0s unlimited, L1 unlimited
                        ExtTag+ AttnBtn- AttnInd- PwrInd- RBE+ FLReset+ SlotPowerLimit 0W
                DevCtl: CorrErr+ NonFatalErr+ FatalErr+ UnsupReq+
                        RlxdOrd+ ExtTag+ PhantFunc- AuxPwr- NoSnoop+ FLReset-
                        MaxPayload 512 bytes, MaxReadReq 512 bytes
                DevSta: CorrErr+ NonFatalErr- FatalErr- UnsupReq+ AuxPwr- TransPend-
                LnkCap: Port #0, Speed 16GT/s, Width x16, ASPM not supported
                        ClockPM- Surprise- LLActRep- BwNot- ASPMOptComp+
                LnkCtl: ASPM Disabled; RCB 64 bytes, Disabled- CommClk-
                        ExtSynch- ClockPM- AutWidDis- BWInt- AutBWInt-
                LnkSta: Speed 16GT/s, Width x8 (downgraded)
                        TrErr- Train- SlotClk+ DLActive- BWMgmt- ABWMgmt-
                DevCap2: Completion Timeout: Range ABC, TimeoutDis+ NROPrPrP- LTR-
                         10BitTagComp+ 10BitTagReq- OBFF Not Supported, ExtFmt- EETLPPrefix-
                         EmergencyPowerReduction Not Supported, EmergencyPowerReductionInit-
                         FRS- TPHComp- ExtTPHComp-
                         AtomicOpsCap: 32bit- 64bit- 128bitCAS-
                DevCtl2: Completion Timeout: 50us to 50ms, TimeoutDis- LTR- 10BitTagReq- OBFF Disabled,
                         AtomicOpsCtl: ReqEn-
                LnkSta2: Current De-emphasis Level: -6dB, EqualizationComplete- EqualizationPhase1-
                         EqualizationPhase2- EqualizationPhase3- LinkEqualizationRequest-
                         Retimer- 2Retimers- CrosslinkRes: unsupported
        Capabilities: [48] Vital Product Data
                Product Name: CX516A - ConnectX-5 QSFP28
                Read-only fields:
                        [PN] Part number: MCX516A-CDAT    
                        [EC] Engineering changes: AA
                        [V2] Vendor specific: MCX516A-CDAT    
                        [SN] Serial number: MT2017X21701          
                        [V3] Vendor specific: f0ff9ba3728aea1180000c42a16a9448
                        [VA] Vendor specific: MLX:MODL=CX516A:MN=MLNX:CSKU=V2:UUID=V3:PCI=V0
                        [V0] Vendor specific: PCIeGen4 x16
                        [RV] Reserved: checksum good, 2 byte(s) reserved
                End
        Capabilities: [9c] MSI-X: Enable- Count=64 Masked-
                Vector table: BAR=0 offset=00002000
                PBA: BAR=0 offset=00003000
        Capabilities: [c0] Vendor Specific Information: Len=18 <?>
        Capabilities: [40] Power Management version 3
                Flags: PMEClk- DSI- D1- D2- AuxCurrent=375mA PME(D0-,D1-,D2-,D3hot-,D3cold+)
                Status: D0 NoSoftRst+ PME-Enable- DSel=0 DScale=0 PME-
        Capabilities: [100 v1] Advanced Error Reporting
                UESta:  DLP- SDES- TLP- FCP- CmpltTO- CmpltAbrt- UnxCmplt- RxOF- MalfTLP- ECRC- UnsupReq- ACSViol-
                UEMsk:  DLP- SDES- TLP- FCP- CmpltTO- CmpltAbrt- UnxCmplt- RxOF- MalfTLP- ECRC- UnsupReq- ACSViol-
                UESvrt: DLP+ SDES- TLP- FCP+ CmpltTO- CmpltAbrt- UnxCmplt- RxOF+ MalfTLP+ ECRC- UnsupReq- ACSViol-
                CESta:  RxErr- BadTLP- BadDLLP- Rollover- Timeout- AdvNonFatalErr+
                CEMsk:  RxErr- BadTLP- BadDLLP- Rollover- Timeout- AdvNonFatalErr+
                AERCap: First Error Pointer: 04, ECRCGenCap+ ECRCGenEn- ECRCChkCap+ ECRCChkEn-
                        MultHdrRecCap- MultHdrRecEn- TLPPfxPres- HdrLogCap-
                HeaderLog: 00000000 00000000 00000000 00000000
        Capabilities: [150 v1] Alternative Routing-ID Interpretation (ARI)
                ARICap: MFVC- ACS-, Next Function: 0
                ARICtl: MFVC- ACS-, Function Group: 0
        Capabilities: [180 v1] Single Root I/O Virtualization (SR-IOV)
                IOVCap: Migration- 10BitTagReq- Interrupt Message Number: 000
                IOVCtl: Enable- Migration- Interrupt- MSE- ARIHierarchy- 10BitTagReq-
                IOVSta: Migration-
                Initial VFs: 64, Total VFs: 64, Number of VFs: 0, Function Dependency Link: 00
                VF offset: 65, stride: 1, Device ID: 101a
                Supported Page Size: 000007ff, System Page Size: 00000001
                Region 0: Memory at 000000180c000000 (64-bit, prefetchable)
                VF Migration: offset: 00000000, BIR: 0
        Capabilities: [230 v1] Access Control Services
                ACSCap: SrcValid- TransBlk- ReqRedir- CmpltRedir- UpstreamFwd- EgressCtrl- DirectTrans-
                ACSCtl: SrcValid- TransBlk- ReqRedir- CmpltRedir- UpstreamFwd- EgressCtrl- DirectTrans-
        Capabilities: [420 v1] Data Link Feature <?>

radxa@RadxaOrionO6:~$ 
